{
  "$schema": "https://json-schema.org/draft/2020-12/schema",
  "type": "object",
  "properties": {
    "$schema": {
      "type": "string"
    },
    "format_version": {
      "type": "number",
      "const": 1
    },
    "window": {
      "type": "object",
      "properties": {
        "name": {
          "type": "string"
        },
        "class": {
          "type": "string",
          "enum": [
            "Window",
            "Dialog"
          ]
        },
        "properties": {
          "type": "object",
          "propertyNames": {
            "type": "string"
          },
          "additionalProperties": {
            "$ref": "#/$defs/__schema0"
          }
        },
        "events": {
          "type": "object",
          "propertyNames": {
            "type": "string"
          },
          "additionalProperties": {
            "type": "string"
          }
        },
        "menu_bar": {
          "type": "object",
          "properties": {
            "name": {
              "type": "string"
            },
            "properties": {
              "type": "object",
              "propertyNames": {
                "type": "string"
              },
              "additionalProperties": {
                "$ref": "#/$defs/__schema0"
              }
            },
            "menus": {
              "type": "array",
              "items": {
                "$ref": "#/$defs/__schema1"
              }
            }
          },
          "additionalProperties": false
        },
        "tool_bar": {
          "type": "object",
          "properties": {
            "name": {
              "type": "string"
            },
            "properties": {
              "type": "object",
              "propertyNames": {
                "type": "string"
              },
              "additionalProperties": {
                "$ref": "#/$defs/__schema0"
              }
            },
            "items": {
              "type": "array",
              "items": {
                "type": "object",
                "properties": {
                  "action": {
                    "type": "string"
                  },
                  "separator": {
                    "type": "boolean",
                    "const": true
                  },
                  "widget": {
                    "$ref": "#/$defs/__schema2"
                  }
                },
                "additionalProperties": false
              }
            }
          },
          "additionalProperties": false
        },
        "status_bar": {
          "type": "object",
          "properties": {
            "name": {
              "type": "string"
            },
            "properties": {
              "type": "object",
              "propertyNames": {
                "type": "string"
              },
              "additionalProperties": {
                "$ref": "#/$defs/__schema0"
              }
            },
            "widgets": {
              "type": "array",
              "items": {
                "$ref": "#/$defs/__schema2"
              }
            }
          },
          "additionalProperties": false
        },
        "layout": {
          "type": "object",
          "properties": {
            "name": {
              "type": "string"
            },
            "class": {
              "type": "string"
            },
            "properties": {
              "type": "object",
              "propertyNames": {
                "type": "string"
              },
              "additionalProperties": {
                "$ref": "#/$defs/__schema0"
              }
            },
            "items": {
              "type": "array",
              "items": {
                "type": "object",
                "properties": {
                  "widget": {
                    "$ref": "#/$defs/__schema2"
                  },
                  "stretch": {
                    "type": "integer",
                    "minimum": 0,
                    "maximum": 9007199254740991
                  },
                  "alignment": {
                    "type": "string"
                  },
                  "spacing": {
                    "type": "number",
                    "minimum": 0
                  },
                  "row": {
                    "type": "integer",
                    "minimum": 0,
                    "maximum": 9007199254740991
                  },
                  "column": {
                    "type": "integer",
                    "minimum": 0,
                    "maximum": 9007199254740991
                  },
                  "row_span": {
                    "type": "integer",
                    "minimum": 1,
                    "maximum": 9007199254740991
                  },
                  "column_span": {
                    "type": "integer",
                    "minimum": 1,
                    "maximum": 9007199254740991
                  },
                  "horizontal": {
                    "type": "string"
                  },
                  "vertical": {
                    "type": "string"
                  },
                  "placement": {
                    "type": "object",
                    "propertyNames": {
                      "type": "string"
                    },
                    "additionalProperties": {
                      "$ref": "#/$defs/__schema0"
                    }
                  }
                },
                "additionalProperties": false
              }
            },
            "rows": {
              "type": "object",
              "propertyNames": {
                "type": "string",
                "pattern": "^(0|[1-9][0-9]*)$"
              },
              "additionalProperties": {
                "type": "object",
                "properties": {
                  "stretch": {
                    "type": "integer",
                    "minimum": 0,
                    "maximum": 9007199254740991
                  },
                  "minimum": {
                    "type": "number",
                    "minimum": 0
                  }
                },
                "additionalProperties": false
              }
            },
            "columns": {
              "type": "object",
              "propertyNames": {
                "type": "string",
                "pattern": "^(0|[1-9][0-9]*)$"
              },
              "additionalProperties": {
                "type": "object",
                "properties": {
                  "stretch": {
                    "type": "integer",
                    "minimum": 0,
                    "maximum": 9007199254740991
                  },
                  "minimum": {
                    "type": "number",
                    "minimum": 0
                  }
                },
                "additionalProperties": false
              }
            }
          },
          "required": [
            "class"
          ],
          "additionalProperties": false
        },
        "children": {
          "type": "array",
          "items": {
            "$ref": "#/$defs/__schema2"
          }
        },
        "buttons": {
          "type": "array",
          "items": {
            "type": "object",
            "properties": {
              "button": {
                "type": "string"
              },
              "text": {
                "type": "string"
              }
            },
            "required": [
              "button"
            ],
            "additionalProperties": false
          }
        }
      },
      "required": [
        "name",
        "class"
      ],
      "additionalProperties": false
    },
    "actions": {
      "type": "array",
      "items": {
        "type": "object",
        "properties": {
          "name": {
            "type": "string"
          },
          "properties": {
            "type": "object",
            "propertyNames": {
              "type": "string"
            },
            "additionalProperties": {
              "$ref": "#/$defs/__schema0"
            }
          },
          "events": {
            "type": "object",
            "propertyNames": {
              "type": "string"
            },
            "additionalProperties": {
              "type": "string"
            }
          }
        },
        "required": [
          "name"
        ],
        "additionalProperties": false
      }
    },
    "objects": {
      "type": "array",
      "items": {
        "type": "object",
        "properties": {
          "name": {
            "type": "string"
          },
          "class": {
            "type": "string"
          },
          "properties": {
            "type": "object",
            "propertyNames": {
              "type": "string"
            },
            "additionalProperties": {
              "$ref": "#/$defs/__schema0"
            }
          },
          "events": {
            "type": "object",
            "propertyNames": {
              "type": "string"
            },
            "additionalProperties": {
              "type": "string"
            }
          }
        },
        "required": [
          "name",
          "class"
        ],
        "additionalProperties": false
      }
    }
  },
  "required": [
    "format_version",
    "window"
  ],
  "additionalProperties": false,
  "$defs": {
    "__schema0": {
      "anyOf": [
        {
          "type": "string"
        },
        {
          "type": "number"
        },
        {
          "type": "boolean"
        },
        {
          "type": "null"
        },
        {
          "type": "array",
          "items": {
            "$ref": "#/$defs/__schema0"
          }
        },
        {
          "type": "object",
          "propertyNames": {
            "type": "string"
          },
          "additionalProperties": {
            "$ref": "#/$defs/__schema0"
          }
        }
      ]
    },
    "__schema1": {
      "type": "object",
      "properties": {
        "name": {
          "type": "string"
        },
        "title": {
          "type": "string"
        },
        "items": {
          "type": "array",
          "items": {
            "type": "object",
            "properties": {
              "action": {
                "type": "string"
              },
              "separator": {
                "type": "boolean",
                "const": true
              },
              "menu": {
                "$ref": "#/$defs/__schema1"
              }
            },
            "additionalProperties": false
          }
        }
      },
      "required": [
        "title"
      ],
      "additionalProperties": false
    },
    "__schema2": {
      "type": "object",
      "properties": {
        "name": {
          "type": "string"
        },
        "class": {
          "type": "string"
        },
        "properties": {
          "type": "object",
          "propertyNames": {
            "type": "string"
          },
          "additionalProperties": {
            "$ref": "#/$defs/__schema0"
          }
        },
        "events": {
          "type": "object",
          "propertyNames": {
            "type": "string"
          },
          "additionalProperties": {
            "type": "string"
          }
        },
        "actions": {
          "type": "array",
          "items": {
            "type": "string"
          }
        },
        "layout": {
          "type": "object",
          "properties": {
            "name": {
              "type": "string"
            },
            "class": {
              "type": "string"
            },
            "properties": {
              "type": "object",
              "propertyNames": {
                "type": "string"
              },
              "additionalProperties": {
                "$ref": "#/$defs/__schema0"
              }
            },
            "items": {
              "type": "array",
              "items": {
                "type": "object",
                "properties": {
                  "widget": {
                    "$ref": "#/$defs/__schema2"
                  },
                  "stretch": {
                    "type": "integer",
                    "minimum": 0,
                    "maximum": 9007199254740991
                  },
                  "alignment": {
                    "type": "string"
                  },
                  "spacing": {
                    "type": "number",
                    "minimum": 0
                  },
                  "row": {
                    "type": "integer",
                    "minimum": 0,
                    "maximum": 9007199254740991
                  },
                  "column": {
                    "type": "integer",
                    "minimum": 0,
                    "maximum": 9007199254740991
                  },
                  "row_span": {
                    "type": "integer",
                    "minimum": 1,
                    "maximum": 9007199254740991
                  },
                  "column_span": {
                    "type": "integer",
                    "minimum": 1,
                    "maximum": 9007199254740991
                  },
                  "horizontal": {
                    "type": "string"
                  },
                  "vertical": {
                    "type": "string"
                  },
                  "placement": {
                    "type": "object",
                    "propertyNames": {
                      "type": "string"
                    },
                    "additionalProperties": {
                      "$ref": "#/$defs/__schema0"
                    }
                  }
                },
                "additionalProperties": false
              }
            },
            "rows": {
              "type": "object",
              "propertyNames": {
                "type": "string",
                "pattern": "^(0|[1-9][0-9]*)$"
              },
              "additionalProperties": {
                "type": "object",
                "properties": {
                  "stretch": {
                    "type": "integer",
                    "minimum": 0,
                    "maximum": 9007199254740991
                  },
                  "minimum": {
                    "type": "number",
                    "minimum": 0
                  }
                },
                "additionalProperties": false
              }
            },
            "columns": {
              "type": "object",
              "propertyNames": {
                "type": "string",
                "pattern": "^(0|[1-9][0-9]*)$"
              },
              "additionalProperties": {
                "type": "object",
                "properties": {
                  "stretch": {
                    "type": "integer",
                    "minimum": 0,
                    "maximum": 9007199254740991
                  },
                  "minimum": {
                    "type": "number",
                    "minimum": 0
                  }
                },
                "additionalProperties": false
              }
            }
          },
          "required": [
            "class"
          ],
          "additionalProperties": false
        },
        "children": {
          "type": "array",
          "items": {
            "$ref": "#/$defs/__schema2"
          }
        },
        "tabs": {
          "type": "array",
          "items": {
            "type": "object",
            "properties": {
              "name": {
                "type": "string"
              },
              "properties": {
                "type": "object",
                "propertyNames": {
                  "type": "string"
                },
                "additionalProperties": {
                  "$ref": "#/$defs/__schema0"
                }
              },
              "page": {
                "$ref": "#/$defs/__schema2"
              }
            },
            "required": [
              "page"
            ],
            "additionalProperties": false
          }
        },
        "panes": {
          "type": "array",
          "items": {
            "type": "object",
            "properties": {
              "name": {
                "type": "string"
              },
              "properties": {
                "type": "object",
                "propertyNames": {
                  "type": "string"
                },
                "additionalProperties": {
                  "$ref": "#/$defs/__schema0"
                }
              },
              "widget": {
                "$ref": "#/$defs/__schema2"
              }
            },
            "required": [
              "widget"
            ],
            "additionalProperties": false
          }
        },
        "content": {
          "$ref": "#/$defs/__schema2"
        }
      },
      "required": [
        "name",
        "class"
      ],
      "additionalProperties": false
    }
  }
}
